{
  "$schema": "https://json-schema.org/draft/2020-12/schema",
  "$id": "statute_section.schema.json",
  "title": "StatuteSection",
  "type": "object",
  "additionalProperties": false,
  "required": ["jurisdiction", "code", "section", "title", "text_summary"],
  "properties": {
    "jurisdiction": { "type": "string", "pattern": "^[a-z]{2}-[a-z-]+$" },
    "code": { "type": "string", "minLength": 1 },
    "section": { "type": "string", "minLength": 1 },
    "title": { "type": "string", "minLength": 1 },
    "text_summary": { "type": "string", "minLength": 1 },
    "elements": {
      "type": "array",
      "items": {
        "type": "object",
        "additionalProperties": false,
        "required": ["id", "description"],
        "properties": {
          "id": { "type": "string", "minLength": 1 },
          "description": { "type": "string", "minLength": 1 }
        }
      }
    }
  }
}
